url,page_id,current_title,new_title,current_description,new_description,canonical
https://www.maxxbuilders.com/why-75-of-commercial-construction-projects-miss-deadlines/,,Why 75% of Construction Projects Miss Deadlines | KPMG Research,Why 75% of Construction Projects Miss Deadlines (KPMG),,"KPMG data shows only 25% of commercial projects finish on schedule. See why deadlines slip, what delays cost Texas developers, and how to avoid them.",https://www.maxxbuilders.com/why-75-of-commercial-construction-projects-miss-deadlines/
https://www.maxxbuilders.com/services/,,Commercial Construction Services | Maxx Builders,,,"Maxx Builders' Texas commercial construction services: construction management, design-build, general contracting, preconstruction, tenant improvement.",https://www.maxxbuilders.com/services/
https://www.maxxbuilders.com/6-tips-to-avoid-common-construction-delays/,,6 Tips to Avoid Common Construction Delays | Maxx Builders,,,"Six tips to prevent common construction delays: improve management, assign clear roles, schedule contractors early, and communicate to stay on schedule.",https://www.maxxbuilders.com/6-tips-to-avoid-common-construction-delays/
https://www.maxxbuilders.com/selecting-perfect-site-commercial-location/,,Selecting the Perfect Site: Ultimate Guide for Commercial Locations,How to Choose a Commercial Building Site in Texas,,"How to choose a commercial building site in Texas: decision framework, metro cost variance, long-lead material coordination, insurance, bonding, and risk.",https://www.maxxbuilders.com/selecting-perfect-site-commercial-location/
https://www.maxxbuilders.com/financing-options-for-shopping-center-projects-ultimate-guide/,,Ultimate Guide to Financing Options for Shopping Center Projects,Shopping Center Financing Options: Complete Guide,,"Compare shopping center project financing: bank loans, private capital, partnerships, crowdfunding, leasebacks, grants, and Texas tax incentives.",https://www.maxxbuilders.com/financing-options-for-shopping-center-projects-ultimate-guide/
https://www.maxxbuilders.com/10-reasons-construction-project-falls-behind-schedule/,,10 Reasons Construction Project falls behind Schedule | Maxx Builders,10 Reasons Construction Projects Fall Behind Schedule,,"The 10 most common reasons construction projects fall behind schedule, plus critical-path risks by phase and how to mitigate delays before they cost you.",https://www.maxxbuilders.com/10-reasons-construction-project-falls-behind-schedule/
https://www.maxxbuilders.com/houston-commercial-contractors/,,"Houston, TX Commercial General Contractors | Maxx Builders",,,"Maxx Builders is a Houston commercial general contractor offering design-build, general contracting, preconstruction, and tenant improvement across Texas.",https://www.maxxbuilders.com/houston-commercial-contractors/
https://www.maxxbuilders.com/new-construction-permit-process-guide/,,Ultimate Guide to Permit Process in New Commercial Construction,Commercial Construction Permit Process Guide (Texas),,"How Texas commercial construction permits work: project phases from concept to certificate of occupancy, critical-path items, and schedule-risk mitigation.",https://www.maxxbuilders.com/new-construction-permit-process-guide/
https://www.maxxbuilders.com/how-to-choose-the-right-commercial-general-contractor-for-your-project/,,Selecting the Right Commercial General Contractor In-Depth Guide,How to Choose the Right Commercial General Contractor,,"A guide to choosing a commercial general contractor: how to vet experience, communication, safety records, financials, and bids before you sign.",https://www.maxxbuilders.com/how-to-choose-the-right-commercial-general-contractor-for-your-project/
https://www.maxxbuilders.com/securing-key-tenants-for-shopping-center/,,Attracting Anchors: How to Secure Key Tenants for Your Shopping Center | Maxx Builders,How to Attract & Secure Anchor Tenants for Retail Centers,,"How to attract and secure anchor tenants for a Texas shopping center, with 2026 retail market considerations, submarket trends, and build-out phasing.",https://www.maxxbuilders.com/securing-key-tenants-for-shopping-center/
https://www.maxxbuilders.com/top-5-tips-for-your-next-commercial-construction-project/,,Top 5 Tips For Your Next Commercial Construction Project | Maxx Builders,Top 5 Tips for Your Next Commercial Construction Project,,"Five practical tips for your next Texas commercial build: vetting contractors, cost variance across metros, long-lead materials, and insurance and bonding.",https://www.maxxbuilders.com/top-5-tips-for-your-next-commercial-construction-project/
https://www.maxxbuilders.com/contact/contact-information/,,Contact Information | Maxx Builders,,,"Contact Maxx Builders, a Texas commercial general contractor. Call 832.871.4166 or email us Mon–Fri 8:30 AM–6 PM and Saturday 9 AM–5 PM.",https://www.maxxbuilders.com/contact/contact-information/
https://www.maxxbuilders.com/projects/car-wash/,,Car Wash | Maxx Builders,,,"Maxx Builders builds commercial car wash facilities across Texas, handling ground-up construction from site work to finish as your general contractor.",https://www.maxxbuilders.com/projects/car-wash/
https://www.maxxbuilders.com/dallas-tx/,,Dallas Commercial General Contractors | Maxx Builders,,,"Dallas commercial general contractor delivering design-build, construction management, and preconstruction for retail, healthcare, and industrial projects.",https://www.maxxbuilders.com/dallas-tx/
https://www.maxxbuilders.com/locations/arlington-commercial-construction-companies/,,"Commercial General Contractors in Arlington, TX | Maxx Builders","Commercial General Contractors in Arlington, TX",,"Maxx Builders is a commercial general contractor serving Arlington and the DFW metro, with hospitality, industrial, and medical construction across Texas.",https://www.maxxbuilders.com/locations/arlington-commercial-construction-companies/
https://www.maxxbuilders.com/benefits-of-lessons-learned-in-construction-management/,,Benefits of Lessons Learned in Construction Management | Maxx Builders,Lessons Learned in Construction Management: Benefits,,"See how documenting lessons learned prevents budget overruns, scope creep, and missed deadlines—plus steps to capture them across every project phase.",https://www.maxxbuilders.com/benefits-of-lessons-learned-in-construction-management/
https://www.maxxbuilders.com/7-critical-steps-for-a-successful-commercial-construction-project-closeouts/,,7 Critical Steps for a Successful Commercial Construction Project Closeouts | Maxx Builders,7 Steps to a Successful Commercial Construction Closeout,,"The 7 activities that close out a commercial construction project: project, client, organizational, and subcontractor closeout, plus final reporting.",https://www.maxxbuilders.com/7-critical-steps-for-a-successful-commercial-construction-project-closeouts/
https://www.maxxbuilders.com/top-commercial-building-types-in-demand-across-texas-2025-2027/,,Top Commercial Building Types in Demand Across Texas,,,"See which commercial building types lead Texas construction in 2025–2027: industrial, healthcare, multifamily, hospitality, retail, and design-build.",https://www.maxxbuilders.com/top-commercial-building-types-in-demand-across-texas-2025-2027/
https://www.maxxbuilders.com/value-engineering-guide-commercial-construction/,,Strategic Guide to Value Engineering in Commercial Construction,Value Engineering for Commercial Construction in Texas,,"Value engineering can cut commercial construction cost 5–15% without sacrificing quality. Where it saves most, when to skip it, how to run a VE workshop.",https://www.maxxbuilders.com/value-engineering-guide-commercial-construction/
https://www.maxxbuilders.com/following-franchise-design-guidelines/,,Franchise Architecture Mastery: Ensuring Design Consistency,,,"How franchise design guidelines keep brand identity consistent—covering required architectural style, color schemes, signage, and interior layouts.",https://www.maxxbuilders.com/following-franchise-design-guidelines/
https://www.maxxbuilders.com/7-advantages-of-podium-slab-in-hotels-multi-family-construction/,,7 Advantages of Podium Slab in Hotels & Multi-family Construction | Maxx Builders,7 Advantages of Podium Slab for Hotel & Multi-Family Builds,,Why podium slab construction saves cost and schedule on 5-plus-story Texas hotels and multi-family builds—light-frame wood stacked over a concrete podium.,https://www.maxxbuilders.com/7-advantages-of-podium-slab-in-hotels-multi-family-construction/
https://www.maxxbuilders.com/how-to-keep-your-hotel-rooms-quiet-part-1-stc-rating/,,How to Keep Your Hotel Rooms Quiet! | Part 1: STC Rating | Maxx Builders,Hotel STC Ratings: Keep Guest Rooms Quiet (Part 1),,"What STC rating means, how to verify it, and how brand standards, cost, and schedule shape quiet guest rooms in Texas hotel construction.",https://www.maxxbuilders.com/how-to-keep-your-hotel-rooms-quiet-part-1-stc-rating/
https://www.maxxbuilders.com/join-our-team/subcontractors/,,Subcontractors | Maxx Builders,,,"Partner with Maxx Builders as a subcontractor on Texas commercial construction projects across Houston, Dallas, Austin and San Antonio.",https://www.maxxbuilders.com/join-our-team/subcontractors/
https://www.maxxbuilders.com/guide-commercial-construction-bids/,,Comprehensive Guide to Commercial Construction Bids,,,"Understand commercial construction bids: bid structure, key components, CSI-format proposals, and inclusions vs. exclusions to review before signing.",https://www.maxxbuilders.com/guide-commercial-construction-bids/
https://www.maxxbuilders.com/cost-effective-commercial-construction-strategies/,,Proven Cost-Saving Strategies for Commercial Construction,,,"Cut commercial construction costs in Texas with strategies for planning, budgeting, contractor selection, material procurement, and project management.",https://www.maxxbuilders.com/cost-effective-commercial-construction-strategies/
https://www.maxxbuilders.com/projects/healthcare-facilities/,,Healthcare Facilities | Maxx Builders,,,"Explore Maxx Builders' healthcare facility construction across Texas, featuring dental and medical projects like Heartland Dental.",https://www.maxxbuilders.com/projects/healthcare-facilities/
https://www.maxxbuilders.com/top-10-questions-to-ask-before-purchasing-your-commercial-property-part-2-zoning/,,Top 10 Questions to Ask Before Purchasing Your Commercial Property (Part 2: Zoning) | Maxx Builders,Zoning Questions to Ask Before Buying Commercial Property,,How zoning shapes where and what you can build in Texas: match zoning to your intended use and confirm restrictions with local jurisdictions before buying.,https://www.maxxbuilders.com/top-10-questions-to-ask-before-purchasing-your-commercial-property-part-2-zoning/
https://www.maxxbuilders.com/7-factors-that-affect-the-construction-cost-of-a-commercial-construction-project/,,7 Factors that Affect the Construction Cost of a Commercial Construction Project | Maxx Builders,7 Factors That Drive Commercial Construction Costs,,"The seven factors that determine commercial construction cost—client priorities, site, design, procurement, method and market conditions—for Texas builds.",https://www.maxxbuilders.com/7-factors-that-affect-the-construction-cost-of-a-commercial-construction-project/
https://www.maxxbuilders.com/the-ultimate-checklist-for-project-owners-starting-a-commercial-construction-project/,,Essential Commercial Construction Checklist for Project Owners,Texas Commercial Construction Checklist for Owners,,"A checklist for Texas project owners: define goals, choose a contractor, budget across metros, coordinate long-lead materials, and allocate risk.",https://www.maxxbuilders.com/the-ultimate-checklist-for-project-owners-starting-a-commercial-construction-project/
https://www.maxxbuilders.com/the-top-10-factors-to-consider-when-choosing-a-car-wash-site/,,The Top 10 Factors to Consider When Choosing a Car Wash Site | Maxx Builders,Choosing a Car Wash Site: Top 10 Factors to Consider,,"Ten factors for picking a car wash location in Texas—demographics, vehicle counts, and more—from a contractor who builds fuel and car wash retail sites.",https://www.maxxbuilders.com/the-top-10-factors-to-consider-when-choosing-a-car-wash-site/
https://www.maxxbuilders.com/maxx-builders-houston-commercial-construction-guide/,,Choosing the Best Houston Commercial Construction Company,,,"How to choose a Houston commercial construction company: a 2026 decision framework covering cost variance, long-lead materials, bonding, and risk.",https://www.maxxbuilders.com/maxx-builders-houston-commercial-construction-guide/
https://www.maxxbuilders.com/projects/restaurants/,,Restaurants | Maxx Builders,,,"See restaurant construction projects by Maxx Builders, Texas commercial general contractors, including the Glazed Doughnut Cafe.",https://www.maxxbuilders.com/projects/restaurants/
https://www.maxxbuilders.com/navigating-franchise-build-out-costs/,,Crunching Numbers: Navigating Your Franchise Build-Out Costs | Maxx Builders,Franchise Build-Out Costs in Texas: How to Plan Ahead,,"What drives franchise build-out costs and how to manage them—key factors, budgeting tips, and lessons from a Texas commercial design-build contractor.",https://www.maxxbuilders.com/navigating-franchise-build-out-costs/
https://www.maxxbuilders.com/blog/,,Blog | Maxx Builders,,,"Commercial construction insights from Maxx Builders: cost guides, design-build delivery, and project tips for Houston, Dallas, and Texas markets.",https://www.maxxbuilders.com/blog/
https://www.maxxbuilders.com/10-factors-that-affect-quality-on-commercial-construction-projects/,,10 Factors that Affect the Quality of Commercial Construction Projects | Maxx Builders,10 Factors That Affect Commercial Construction Quality,,"10 factors that make or break commercial construction quality: material defects, subcontractor errors, scope creep, poor communication, and skipped audits.",https://www.maxxbuilders.com/10-factors-that-affect-quality-on-commercial-construction-projects/
https://www.maxxbuilders.com/preparing-for-a-commercial-construction-project-a-clients-guide/,,Preparing for a Commercial Construction Project: The Ultimate Client Guide,How to Prepare for a Commercial Construction Project,,"A step-by-step client guide to planning a commercial construction project: scope, team, budget, permits, design, site prep, risk, and post-construction.",https://www.maxxbuilders.com/preparing-for-a-commercial-construction-project-a-clients-guide/
https://www.maxxbuilders.com/press-release/,,Press Release Page | Maxx Builders,,,"Maxx Builders press releases: Y-Shoppes @ Morton and @ Tejas groundbreakings in Conroe, TX, a Home2Suites by Hilton, and 2017 Inc. 5000 recognition.",https://www.maxxbuilders.com/press-release/
https://www.maxxbuilders.com/inc-magazine-unveils-its-37th-annual-list-of-americas-fastest-growing-private-companies-the-inc-5/,,Inc. Magazine Unveils its 37th Annual List of America’s Fastest-Growing Private Companies—the Inc. 5 | Maxx Builders,Maxx Builders Named to Inc. 5000 Fastest-Growing List,,Maxx Builders earned a spot on Inc.'s 37th annual Inc. 5000 list of fastest-growing private companies. See how the Texas commercial GC builds.,https://www.maxxbuilders.com/inc-magazine-unveils-its-37th-annual-list-of-americas-fastest-growing-private-companies-the-inc-5/
https://www.maxxbuilders.com/about/mission-values/,,Mission + Values | Maxx Builders,,,"The mission and values behind Maxx Builders' commercial construction across Texas, from Houston and Dallas to Austin, San Antonio, and Fort Worth.",https://www.maxxbuilders.com/about/mission-values/
https://www.maxxbuilders.com/client-resources/,,E-books & Guides on Commercial Construction | Maxx Builders,,,"Explore Maxx Builders' e-books and guides on commercial construction—practical resources on planning, budgeting, and building projects across Texas.",https://www.maxxbuilders.com/client-resources/
https://www.maxxbuilders.com/culinary-constructions-designing-the-perfect-restaurant-space/,,Culinary Constructions: Designing the Perfect Restaurant Space,Restaurant Design & Construction: Building the Perfect Space,,"How restaurant aesthetics, kitchen layout, sustainable build-outs, and design ROI shape Texas restaurant spaces, plus build-out phasing tips.",https://www.maxxbuilders.com/culinary-constructions-designing-the-perfect-restaurant-space/
https://www.maxxbuilders.com/lien-waivers-on-commercial-construction-projects-what-you-need-to-know/,,Lien Waivers on Commercial Construction Projects: What You Need to Know | Maxx Builders,Lien Waivers on Commercial Construction: A Guide,,"What lien waivers are, why they matter, the main types, and how they protect contractors, subcontractors, and suppliers on commercial projects.",https://www.maxxbuilders.com/lien-waivers-on-commercial-construction-projects-what-you-need-to-know/
https://www.maxxbuilders.com/top-5-questions-to-ask-before-purchasing-commercial-property-part-3-site-infrastructure/,,Top 5 Questions to Ask Before Purchasing Commercial Property (Part 3: Site Infrastructure) | Maxx Builders,Site Infrastructure: Buying Commercial Property in Texas,,"Site infrastructure for commercial property in Texas: how access points, road connections, and traffic determine whether a site can support your build.",https://www.maxxbuilders.com/top-5-questions-to-ask-before-purchasing-commercial-property-part-3-site-infrastructure/
https://www.maxxbuilders.com/terms-and-conditions/,,Terms and Conditions | Maxx Builders,,,"Maxx Builders Terms and Conditions: website use, intellectual property, liability limits, indemnification, governing law, and messaging terms.",https://www.maxxbuilders.com/terms-and-conditions/
https://www.maxxbuilders.com/services/design-and-build/,,Design + Build Services | Maxx Builders,,,"Maxx Builders delivers design-build construction in Texas, uniting architecture, engineering, and building under one contract for commercial projects.",https://www.maxxbuilders.com/services/design-and-build/
https://www.maxxbuilders.com/picking-profitable-locations-warehouse-development/,,Site Selection Mastery: Picking Profitable Locations for Warehouse Development | Maxx Builders,Warehouse Site Selection: Picking Profitable Locations,,"How to choose a profitable warehouse site in Texas: accessibility, transportation, cost drivers, and the budgeting mistakes that derail projects.",https://www.maxxbuilders.com/picking-profitable-locations-warehouse-development/
https://www.maxxbuilders.com/top-5-investments-for-commercial-real-estate-property-investors/,,Top 5 Investments for Commercial Real Estate Property Investors | Maxx Builders,Top 5 Commercial Real Estate Investments in Texas (2026),,"Compare the top commercial real estate investment types—retail, office, hospitality, and multifamily—with the pros and cons of each.",https://www.maxxbuilders.com/top-5-investments-for-commercial-real-estate-property-investors/
https://www.maxxbuilders.com/harnessing-ai-construction-maxx-builders/,,Harnessing AI in Construction: Innovating with Maxx Builders,,,"See how Maxx Builders applies AI to Texas commercial construction: metro cost variance, long-lead materials, bonding, insurance, and risk allocation.",https://www.maxxbuilders.com/harnessing-ai-construction-maxx-builders/
https://www.maxxbuilders.com/choosing-commercial-general-contractor-guide/,,Choosing a Commercial General Contractor: Your Ultimate Guide,How to Choose a Commercial General Contractor in Texas,,"A step-by-step guide to selecting a commercial general contractor in Texas: vetting steps, cost variance across metros, insurance, bonding, and risk.",https://www.maxxbuilders.com/choosing-commercial-general-contractor-guide/
https://www.maxxbuilders.com/the-role-of-technology-in-modern-office-construction/,,The Role of Technology in Modern Office Construction | Maxx Builders,"Technology in Office Construction: BIM, Prefab & IoT",,"See how BIM, prefabrication, VR/AR, IoT smart buildings, and sustainable methods are reshaping office construction, from a Texas commercial contractor.",https://www.maxxbuilders.com/the-role-of-technology-in-modern-office-construction/
https://www.maxxbuilders.com/top-practices-for-a-zero-punchlist-commercial-construction-project/,,Top Practices for a Zero Punchlist Commercial Construction Project | Maxx Builders,Zero-Punchlist Commercial Construction: Top Practices,,"How to deliver a zero-punchlist commercial project in Texas: planning, continuous communication, and stakeholder alignment from day one through closeout.",https://www.maxxbuilders.com/top-practices-for-a-zero-punchlist-commercial-construction-project/
https://www.maxxbuilders.com/design-build-commercial-contractors-streamlining-the-construction-process/,,Design-Build Commercial Contractors: Streamlining the Construction Process | Maxx Builders,Design-Build Commercial Contractors in Texas: 2026 Guide,,"How design-build contractors combine design and construction under one contract, plus how to choose the right firm for your Texas commercial project.",https://www.maxxbuilders.com/design-build-commercial-contractors-streamlining-the-construction-process/
https://www.maxxbuilders.com/effective-layouts-for-shopping-centers/,,Designing for Success: Effective Layouts for Shopping Centers | Maxx Builders,Effective Shopping Center Layouts: Design Principles,,"How smart layout and design choices help brick-and-mortar shopping centers attract and retain customers, plus key principles of effective retail design.",https://www.maxxbuilders.com/effective-layouts-for-shopping-centers/
https://www.maxxbuilders.com/successful-construction-project-guide/,,Top Secrets to a Successful Commercial Construction Projet,,,"How Maxx Builders delivers commercial construction on schedule: phases, critical-path items, and schedule risk mitigation from concept to occupancy.",https://www.maxxbuilders.com/successful-construction-project-guide/
https://www.maxxbuilders.com/permits-zoning-compliance-shopping-center-developers/,,Permits & Zoning 101: Compliance for Shopping Center Developers | Maxx Builders,Permits & Zoning for Shopping Center Developers in Texas,,,https://www.maxxbuilders.com/permits-zoning-compliance-shopping-center-developers/
https://www.maxxbuilders.com/services/architectural-design-and-engineering/,,Architectural Design + Engineering | Maxx Builders,,,Maxx Builders combines architectural design and engineering with construction to deliver commercial projects across Texas under one accountable team.,https://www.maxxbuilders.com/services/architectural-design-and-engineering/
https://www.maxxbuilders.com/commercial-construction-project-inquiry/,,Commercial Construction Project Inquiry | Maxx Builders,,,"Start your commercial construction project with Maxx Builders. Contact our Texas team for general contracting, design-build, and preconstruction inquiries.",https://www.maxxbuilders.com/commercial-construction-project-inquiry/
https://www.maxxbuilders.com/client-resources/construction-terminology/,,Construction Terminology | Maxx Builders,,,Maxx Builders' construction glossary defines common commercial construction terms—a client reference for terminology used on Texas building projects.,https://www.maxxbuilders.com/client-resources/construction-terminology/
https://www.maxxbuilders.com/locations/,,Locations Archive | Maxx Builders,,,"Explore Maxx Builders' commercial construction service areas across Texas: Houston, Dallas, Austin, Fort Worth, and San Antonio.",https://www.maxxbuilders.com/locations/
https://www.maxxbuilders.com/efficient-floor-plans-for-franchise-success/,,Space Mastery: Efficient Floor Plans for Franchise Success | Maxx Builders,Efficient Retail Floor Plans for Franchise Success,,"How efficient floor plans shape franchise operations, customer experience, and profit—with project delivery phases and schedule risk mitigation.",https://www.maxxbuilders.com/efficient-floor-plans-for-franchise-success/
https://www.maxxbuilders.com/why-logistic-planning-are-critical-to-the-success-of-any-construction-project/,,Why Logistic Planning are critical to the success of any construction project | Maxx Builders,Why Logistics Planning Is Critical to Construction Success,,"Construction logistics planning cuts waste, keeps materials on site as needed, and controls schedule risk from concept through certificate of occupancy.",https://www.maxxbuilders.com/why-logistic-planning-are-critical-to-the-success-of-any-construction-project/
https://www.maxxbuilders.com/projects/multi-family-and-mixed-use/,,Multi-family + Mixed Use | Maxx Builders,,,"Explore Maxx Builders' multi-family and mixed-use construction projects across Texas, including the Pearl Apartment development.",https://www.maxxbuilders.com/projects/multi-family-and-mixed-use/
https://www.maxxbuilders.com/privacy-policy/,,Maxx Builders Privacy Policy | Maxx Builders,,,"How Maxx Builders collects, uses, and protects your data, including SMS/text messaging consent, third-party sharing, opt-out rights, and data retention.",https://www.maxxbuilders.com/privacy-policy/
https://www.maxxbuilders.com/texas-commercial-real-estate-trends-in-2023/,,Texas Commercial Real Estate Trends in 2023 | Maxx Builders,,,"Texas commercial real estate trends: key market players, metro cost variance, and how Maxx Builders approaches commercial construction across the state.",https://www.maxxbuilders.com/texas-commercial-real-estate-trends-in-2023/
https://www.maxxbuilders.com/join-our-team/vendors/,,Vendors | Maxx Builders,,,"Become a vendor for Maxx Builders, a Texas commercial general contractor. Connect with our business development team to supply our construction projects.",https://www.maxxbuilders.com/join-our-team/vendors/
