url,page_id,current_title,new_title,current_description,new_description,canonical
https://www.maxxbuilders.com/guide-to-4-different-types-of-shell-structures/,,4 Types of Commercial Shell Structures Explained (2026),,,"Compare four commercial shell types—cold/dark, warm, bare, and vanilla—and how each affects tenant build-out cost and finish time in Texas.",https://www.maxxbuilders.com/guide-to-4-different-types-of-shell-structures/
https://www.maxxbuilders.com/restaurant-construction-cost-per-square-foot-guide-2024/,,How Much does it Cost to Build a Restaurant,,,"See what drives restaurant construction cost per square foot in Texas, with 2026 cost by city, design efficiency tips, and answers to common FAQs.",https://www.maxxbuilders.com/restaurant-construction-cost-per-square-foot-guide-2024/
https://www.maxxbuilders.com/financing-options-for-commercial-construction-projects/,,Financing Options for Commercial Construction Projects,,,"Compare commercial construction loan options for 2026, see how to qualify, and learn why design-build can speed loan approval on Texas projects.",https://www.maxxbuilders.com/financing-options-for-commercial-construction-projects/
https://www.maxxbuilders.com/what-does-it-cost-to-build-an-industrial-warehouse/,,What Does it Cost to Build an Industrial Warehouse? | Maxx Builders,Industrial Warehouse Construction Cost Guide — Texas,,"See what drives industrial warehouse construction costs in Texas: materials, four construction types, cost drivers, and budgeting mistakes to avoid.",https://www.maxxbuilders.com/what-does-it-cost-to-build-an-industrial-warehouse/
https://www.maxxbuilders.com/dental-office-construction-guide/,,Dental Office Construction Texas: 2026 Cost & Build-Out Guide,Dental Office Construction Texas: 2026 Cost & Buildout Guide,,,https://www.maxxbuilders.com/dental-office-construction-guide/
https://www.maxxbuilders.com/importance-of-mock-up-rooms-in-the-hospitality-industry/,,importance-of-mock-up-rooms-in-the-hospitality-industry | Maxx Builders,Mock-Up Rooms in Hotel Construction: Why They Matter,,"Hotel mock-up rooms test brand standards, finishes, ADA compliance, and FF&E placement before full build. Two-stage process, timing, and Texas context.",https://www.maxxbuilders.com/importance-of-mock-up-rooms-in-the-hospitality-industry/
https://www.maxxbuilders.com/fort-worth-tx/,,Fort Worth's Top Commercial General Contractors | Maxx Builders,Fort Worth Commercial General Contractor | Maxx Builders,,"Maxx Builders delivers commercial construction in Fort Worth, TX: retail, industrial, healthcare, restaurant, and hospitality projects.",https://www.maxxbuilders.com/fort-worth-tx/
https://www.maxxbuilders.com/building-healthcare-facilities-guide/,,The Ultimate Guide to Healthcare Construction,,,"How Maxx Builders plans, designs, and builds healthcare facilities in Texas: regulatory compliance, technology integration, safety, and infection control.",https://www.maxxbuilders.com/building-healthcare-facilities-guide/
https://www.maxxbuilders.com/comprehensive-guide-to-houstons-premier-commercial-contractors/,,Houston's Top Commercial Contractors: A Comprehensive Guide,,,"Compare Houston's leading commercial contractors—Maxx Builders, Arch-Con, Structura and more—with each firm's specialties, project focus, and strengths.",https://www.maxxbuilders.com/comprehensive-guide-to-houstons-premier-commercial-contractors/
https://www.maxxbuilders.com/tenant-improvement-contractors-guide/,,The Role of Tenant Improvement Contractors,,,"How tenant improvement contractors adapt commercial spaces to tenant needs—their role, services, costs, timelines, and how to choose one.",https://www.maxxbuilders.com/tenant-improvement-contractors-guide/
https://www.maxxbuilders.com/leading-construction-companies-houston-texas/,,Top Houston Commercial Construction Companies,,,"Compare Houston's top commercial construction firms—Maxx Builders, McCarthy, Beck, DPR and more—with a 2026 decision framework and Texas metro cost data.",https://www.maxxbuilders.com/leading-construction-companies-houston-texas/
https://www.maxxbuilders.com/construction-cost-per-square-foot-for-apartments-in-austin-texas/,,Construction Cost per Square Foot for Apartments in Austin Texas | Maxx Builders,"Apartment Construction Cost Per Square Foot: Austin, TX",,"Garden-style apartment construction in Austin runs $110–$125/sq ft (Gordian 2025, RSMeans). See what drives multi-family costs with Maxx Builders.",https://www.maxxbuilders.com/construction-cost-per-square-foot-for-apartments-in-austin-texas/
https://www.maxxbuilders.com/what-is-the-cost-of-construction-for-a-self-storage-facility/,,What is the Cost of Construction for a Self-Storage Facility? | Maxx Builders,Self-Storage Construction Cost in Texas (2026 Guide),,"How much does it cost to build a self-storage facility in Texas? Cost drivers, budgeting, site selection, sizing, and financing for 2026 developers.",https://www.maxxbuilders.com/what-is-the-cost-of-construction-for-a-self-storage-facility/
https://www.maxxbuilders.com/the-complete-guide-to-tenant-improvement-allowance-for-commercial-leases/,,Complete Guide to Tenant Improvement Allowance,,,"Learn how tenant improvement allowances work, how they relate to build-out costs, and how to maximize TIA value on office, retail, and industrial leases.",https://www.maxxbuilders.com/the-complete-guide-to-tenant-improvement-allowance-for-commercial-leases/
https://www.maxxbuilders.com/5-methods-to-accelerate-your-project-schedule/,,5 Methods to Accelerate Your Project Schedule | Maxx Builders,5 Methods to Accelerate Your Construction Schedule,,"Five methods to accelerate a commercial construction schedule—critical-path items by phase, delivery methodology, and schedule risk mitigation.",https://www.maxxbuilders.com/5-methods-to-accelerate-your-project-schedule/
https://www.maxxbuilders.com/concrete-tilt-up-vs-masonry-buildings-comparison/,,Concrete Tilt-up vs. Masonry Buildings: An In-Depth Comparison,Tilt-Up vs. Masonry Construction: Texas Commercial Guide,,"Compare concrete tilt-up and masonry for commercial construction: strengths, costs, and a Texas framework to choose the right method for your project.",https://www.maxxbuilders.com/concrete-tilt-up-vs-masonry-buildings-comparison/
https://www.maxxbuilders.com/navigating-aia-construction-contracts/,,Navigating AIA Construction Contracts - Essential Guide by Maxx Builders,AIA Construction Contracts Explained: A Practical Guide,,"Understand AIA construction contracts: key features, common contract types, document evolution, and how risk is managed on commercial projects.",https://www.maxxbuilders.com/navigating-aia-construction-contracts/
https://www.maxxbuilders.com/guide-to-franchise-build-out-process/,,Your Step by Step Guide to the Franchise Build-Out Process,,,"Walk the 10 steps of a franchise build-out—from franchise requirements and site selection to permits, construction, and final compliance.",https://www.maxxbuilders.com/guide-to-franchise-build-out-process/
https://www.maxxbuilders.com/projects/fuel-stations/,,Fuel Stations | Maxx Builders,,,"Explore fuel station construction projects by Maxx Builders across Texas, including the 24 Seven @ Cullen build from our commercial general contractors.",https://www.maxxbuilders.com/projects/fuel-stations/
https://www.maxxbuilders.com/challenges-and-considerations-when-planning-mixed-use-developments/,,Navigating Challenges in Mixed-Use Real Estate Development,,,"Navigate the toughest challenges of planning mixed-use developments—zoning, balancing uses, infrastructure, parking, financing, and property management.",https://www.maxxbuilders.com/challenges-and-considerations-when-planning-mixed-use-developments/
https://www.maxxbuilders.com/about/,,About Maxx Builders | Texas Commercial Contractors,,,"Meet Maxx Builders, a Texas commercial general contractor building retail, industrial, healthcare, hospitality and restaurant projects statewide.",https://www.maxxbuilders.com/about/
https://www.maxxbuilders.com/guide-shopping-center-construction-costs/,,Crunching the Numbers: A Guide to Shopping Center Construction Costs | Maxx Builders,Shopping Center Construction Costs: A Texas Guide,,"How much does it cost to build a shopping center? Break down land acquisition, cost per acre, and the financial factors behind the investment.",https://www.maxxbuilders.com/guide-shopping-center-construction-costs/
https://www.maxxbuilders.com/austin-tx/,,"Maxx Builders: Top-Rated Commercial Construction in Austin, TX",Austin Commercial General Contractors | Maxx Builders,,"Commercial general contractor in Austin, TX. Design-build, preconstruction, and tenant improvements for retail, healthcare, and industrial projects.",https://www.maxxbuilders.com/austin-tx/
https://www.maxxbuilders.com/locations/irving-premier-commercial-contractors/,,"Commercial General Contractors in Irving, TX | Maxx Builders",,,"Commercial general contractor serving Irving, TX. Maxx Builders delivers ground-up construction, tenant build-outs, and construction management across DFW.",https://www.maxxbuilders.com/locations/irving-premier-commercial-contractors/
https://www.maxxbuilders.com/austin-commercial-construction-cost-per-square-foot-2026/,,Austin Commercial Construction Cost Per SF (2026),,,"2026 Austin commercial construction cost per square foot by building type, plus why Austin costs more than Houston and Dallas, with full-budget guidance.",https://www.maxxbuilders.com/austin-commercial-construction-cost-per-square-foot-2026/
https://www.maxxbuilders.com/5-best-types-of-commercial-real-estate-loans-to-consider-for-your-business-expansion-or-cre-project/,,5 Best Types of Commercial Real Estate Loans To Consider For Your Business Expansion or CRE Project | Maxx Builders,5 Best Commercial Real Estate Loan Types for CRE Projects,,"Compare five commercial real estate loan types for CRE projects, plus 2026 construction financing, Texas cost drivers, and budgeting mistakes to avoid.",https://www.maxxbuilders.com/5-best-types-of-commercial-real-estate-loans-to-consider-for-your-business-expansion-or-cre-project/
https://www.maxxbuilders.com/services/tenant-improvement/,,Tenant Improvement | Maxx Builders,,,"Commercial tenant improvement buildouts across Texas. Maxx Builders revitalizes retail, office, and industrial leased spaces with confidence and precision.",https://www.maxxbuilders.com/services/tenant-improvement/
https://www.maxxbuilders.com/locations/the-woodlands-commercial-contractors/,,"Premier Commercial General Contractors in The Woodlands, TX | Maxx Builders","Commercial General Contractors in The Woodlands, TX",,"Maxx Builders delivers commercial construction and general contracting in The Woodlands, TX — office, medical, retail, and industrial builds near Houston.",https://www.maxxbuilders.com/locations/the-woodlands-commercial-contractors/
https://www.maxxbuilders.com/join-our-team/,,Join Our Team | Maxx Builders,,,"Build your career with Maxx Builders, a Texas commercial general contractor. Explore open roles and join our team across Houston, Dallas, and Austin.",https://www.maxxbuilders.com/join-our-team/
https://www.maxxbuilders.com/commercial-real-estate-development-step-by-step-process-start-to-finish/,,Commercial Real Estate Development Step-by-step Process: Start to Finish | Maxx Builders,Commercial Real Estate Development: Step-by-Step Process,,"Walk through the commercial real estate development process, from survey and signed purchase contract to construction and tenant turnover.",https://www.maxxbuilders.com/commercial-real-estate-development-step-by-step-process-start-to-finish/
https://www.maxxbuilders.com/7-key-steps-in-creating-and-managing-a-commercial-construction-schedule/,,7 Key Steps in Creating and Managing a Commercial Construction Schedule | Maxx Builders,Commercial Construction Schedule: 7 Key Steps,,"Build and manage a commercial construction schedule in 7 steps—project phases from concept to occupancy, critical-path items, and risk mitigation.",https://www.maxxbuilders.com/7-key-steps-in-creating-and-managing-a-commercial-construction-schedule/
https://www.maxxbuilders.com/key-responsibilities-of-a-commercial-general-contractor/,,Key Responsibilities of a Commercial General Contractor | Maxx Builders,Commercial General Contractor Responsibilities in Texas,,"What a commercial general contractor handles start to finish, plus a Texas hiring framework, metro cost variance, material lead times, and bonding basics.",https://www.maxxbuilders.com/key-responsibilities-of-a-commercial-general-contractor/
https://www.maxxbuilders.com/guide-funding-building-project-successfully/,,Construction Capital: A Guide to Funding Your Building Project Successfully | Maxx Builders,Construction Financing: How to Fund Your Building Project,,"A practical guide to sourcing and securing capital for your construction project, covering funding options and how to prepare a successful application.",https://www.maxxbuilders.com/guide-funding-building-project-successfully/
https://www.maxxbuilders.com/understanding-costs-commercial-real-estate-construction/,,Understanding the Variables: Costs in Commercial Real Estate Construction | Maxx Builders,Commercial Construction Cost Drivers in Texas (2026),,"What drives commercial real estate construction costs in Texas—where the dollars go, the local cost drivers, and the budgeting mistakes to avoid.",https://www.maxxbuilders.com/understanding-costs-commercial-real-estate-construction/
https://www.maxxbuilders.com/7-tips-for-evaluating-a-commercial-construction-bid/,,7 Tips for Evaluating a Commercial Construction Bid | Maxx Builders,7 Tips for Evaluating a Commercial Construction Bid,,"Compare commercial construction bids the right way: what to check in a proposal, pricing red flags, insurance and bonding, and Texas metro cost variance.",https://www.maxxbuilders.com/7-tips-for-evaluating-a-commercial-construction-bid/
https://www.maxxbuilders.com/projects/,,Commercial Construction Projects | Maxx Builders,,,"Explore Maxx Builders' portfolio of completed commercial construction projects across Texas, including the Ace Steel Supply build.",https://www.maxxbuilders.com/projects/
https://www.maxxbuilders.com/join-our-team/careers/,,Careers | Maxx Builders,,,"Explore careers at Maxx Builders, a Texas commercial general contractor. Join our team building retail, industrial, healthcare, and hospitality projects.",https://www.maxxbuilders.com/join-our-team/careers/
https://www.maxxbuilders.com/smooth-sailing-zoning-permitting-restaurant-build/,,Guide to Navigating Zoning and Permitting for Your Restaurant,Restaurant Zoning & Permitting: Texas Build Guide,,"Navigate zoning and permitting for your Texas restaurant build-out, with tips on retail submarkets, build-out phasing, and avoiding costly permit delays.",https://www.maxxbuilders.com/smooth-sailing-zoning-permitting-restaurant-build/
https://www.maxxbuilders.com/commercial-construction-companies-texas-2026/,,Commercial Construction Companies in Texas | Maxx Builders,,,"Compare what Texas commercial construction companies do, delivery models, 2026 costs by metro, and how to choose the right builder for your project.",https://www.maxxbuilders.com/commercial-construction-companies-texas-2026/
https://www.maxxbuilders.com/design-build-construction-houston-2/,,Design-Build Construction Houston | Maxx Builders | Maxx Builders,Design-Build Construction Houston: Owner's Guide,,"How design-build delivers Houston commercial projects under one contract: costs, the process, comparison to design-bid-build, and how to hire.",https://www.maxxbuilders.com/design-build-construction-houston-2/
