url,page_id,current_title,new_title,current_description,new_description,canonical
https://www.maxxbuilders.com/projects/retail-shopping-centers/,,Retail Shopping Centers | Maxx Builders,,,"Explore Maxx Builders' retail shopping center construction projects across Texas, including Y-Shops at Parkwest, built by a commercial general contractor.",https://www.maxxbuilders.com/projects/retail-shopping-centers/
https://www.maxxbuilders.com/mitigating-construction-risks-in-shopping-centers-2/,,Risk-Free Retail: Mitigating Construction Risks in Shopping Centers | Maxx Builders,Mitigating Construction Risks in Shopping Centers (2026),,"Risk mitigation strategies for shopping center construction in Texas—retail market trends, build-out phasing, and lessons from a real Katy TX project.",https://www.maxxbuilders.com/mitigating-construction-risks-in-shopping-centers-2/
https://www.maxxbuilders.com/about/group-of-companies/,,Group of Companies | Maxx Builders,,,"Meet the group of companies behind Maxx Builders, a Texas commercial contractor spanning construction management, design-build, and general contracting.",https://www.maxxbuilders.com/about/group-of-companies/
https://www.maxxbuilders.com/portfolio/flash-fuel-station/,,Flash Fuel Station | Maxx Builders,,,"Tour the Flash Fuel Station project by Maxx Builders, a Texas commercial general contractor specializing in fuel station construction.",https://www.maxxbuilders.com/portfolio/flash-fuel-station/
https://www.maxxbuilders.com/office-construction-trends-to-watch-in-2024/,,Office Construction Trends to Watch in 2024 | Maxx Builders,,,"Office construction trends plus a Texas commercial framework: cost variance across metros, long-lead materials, insurance, bonding, and risk allocation.",https://www.maxxbuilders.com/office-construction-trends-to-watch-in-2024/
https://www.maxxbuilders.com/5-tips-for-streamlining-your-office-construction-project/,,5 Tips for Streamlining Your Office Construction Project | Maxx Builders,5 Tips for Streamlining Your Office Construction Project,,"Five tips to streamline your office construction project: detailed planning, collaboration tools, lean methods, and smarter resource allocation.",https://www.maxxbuilders.com/5-tips-for-streamlining-your-office-construction-project/
https://www.maxxbuilders.com/services/preconstruction/,,Preconstruction | Maxx Builders,,,"Preconstruction services from Maxx Builders align budgeting, scheduling, and design planning early to control costs on Texas commercial builds.",https://www.maxxbuilders.com/services/preconstruction/
https://www.maxxbuilders.com/projects/industrial-and-warehouse/,,Industrial + Warehouse | Maxx Builders,,,"Explore Maxx Builders' industrial and warehouse construction projects across Texas, including the Ace Steel Supply facility build.",https://www.maxxbuilders.com/projects/industrial-and-warehouse/
https://www.maxxbuilders.com/locations/san-antonio-commercial-contractors/,,"Commercial General Contractors in San Antonio, TX | Maxx Builders",San Antonio Commercial General Contractors | Maxx Builders,,"Maxx Builders is a commercial general contractor serving San Antonio, TX, building hospitality, industrial, medical, and retail projects across the metro.",https://www.maxxbuilders.com/locations/san-antonio-commercial-contractors/
https://www.maxxbuilders.com/portfolio/ace-steel-supply/,,Ace Steel Supply | Maxx Builders,,,"Explore the Ace Steel Supply project by Maxx Builders, a Texas commercial general contractor serving Houston, Dallas, Austin, and Fort Worth.",https://www.maxxbuilders.com/portfolio/ace-steel-supply/
https://www.maxxbuilders.com/selecting-prime-spots-for-shopping-centers/,,"Location, Location, Location: Selecting Prime Spots for Shopping Centers | Maxx Builders",Choosing Prime Shopping Center Locations in Texas,,"How to evaluate market demand, traffic, zoning, and costs when selecting a shopping center site in Texas, plus 2026 submarket and build-out phasing tips.",https://www.maxxbuilders.com/selecting-prime-spots-for-shopping-centers/
https://www.maxxbuilders.com/importance-of-quality-control-processes-of-commercial-contractors-inspect-it-now-or-fix-it-later/,,Importance of Quality Control Processes of Commercial Contractors: Inspect it Now or Fix it Later | Maxx Builders,Commercial Construction Quality Control: Contractor Guide,,"How commercial contractors run quality control—QA/QC plans, field inspections, and what to look for when hiring a GC in Texas. Inspect now or fix later.",https://www.maxxbuilders.com/importance-of-quality-control-processes-of-commercial-contractors-inspect-it-now-or-fix-it-later/
https://www.maxxbuilders.com/industries/retail-construction-texas/,,Retail Construction Services in Texas | Maxx Builders,,,"Retail construction across Texas from commercial GC Maxx Builders—shopping centers, storefronts and tenant build-outs for Houston, Dallas and Austin.",https://www.maxxbuilders.com/industries/retail-construction-texas/
https://www.maxxbuilders.com/portfolio/y-shops-greenhouse/,,Y-Shops @ Greenhouse | Maxx Builders,,,"Y-Shops @ Greenhouse: a retail shopping center delivered by Maxx Builders, a Texas commercial general contractor. See the project scope and details.",https://www.maxxbuilders.com/portfolio/y-shops-greenhouse/
https://www.maxxbuilders.com/client-resources/clients-guide/,,Client's Guide | Maxx Builders,,,"Maxx Builders' Client's Guide explains what to expect working with our Texas commercial construction team, from preconstruction through delivery.",https://www.maxxbuilders.com/client-resources/clients-guide/
https://www.maxxbuilders.com/key-considerations-for-franchise-renovations/,,Revamp Right: Key Considerations for Franchise Renovations | Maxx Builders,Franchise Renovation Guide: Key Considerations in Texas,,"What franchise owners need to plan before a renovation: a Texas decision framework, metro cost variance, long-lead material timing, and risk allocation.",https://www.maxxbuilders.com/key-considerations-for-franchise-renovations/
https://www.maxxbuilders.com/mitigating-risks-smooth-construction-development/,,Mitigating Risks: Proactive Strategies for Smooth Construction Development | Maxx Builders,Construction Risk Mitigation: Proactive Strategies,,"Explore proactive strategies to reduce construction risk across every project phase, from concept to certificate of occupancy, plus schedule risk tips.",https://www.maxxbuilders.com/mitigating-risks-smooth-construction-development/
https://www.maxxbuilders.com/commercial-construction-costs-101/,,Commercial Construction Costs 101 | Maxx Builders,,,"See what drives commercial construction costs in Texas—materials, labor, permits, location, and design—plus common budgeting mistakes to avoid.",https://www.maxxbuilders.com/commercial-construction-costs-101/
https://www.maxxbuilders.com/projects/tenant-improvements/,,Tenant Improvements | Maxx Builders,,,Commercial tenant improvement construction across Texas. Maxx Builders delivers interior buildouts like the King Spa project for Houston-area businesses.,https://www.maxxbuilders.com/projects/tenant-improvements/
https://www.maxxbuilders.com/top-10-questions-to-ask-before-selecting-your-commercial-contractor/,,Top 10 Questions to Ask Before Selecting your Commercial Contractor? | Maxx Builders,10 Questions to Ask Before Hiring a Commercial Contractor,,"The 10 questions Texas developers should ask before hiring a commercial contractor — cost variance, long-lead materials, insurance, and bonding.",https://www.maxxbuilders.com/top-10-questions-to-ask-before-selecting-your-commercial-contractor/
https://www.maxxbuilders.com/industries/industrial-warehouse-construction-texas/,,Industrial & Warehouse Construction Texas | Maxx Builders,,,"Industrial and warehouse construction across Texas—distribution centers, cross-dock facilities, and flex space in Houston, Dallas, and Austin.",https://www.maxxbuilders.com/industries/industrial-warehouse-construction-texas/
https://www.maxxbuilders.com/industries/hotel-hospitality-construction-texas/,,Hotel & Hospitality Construction Texas | Maxx Builders,,,"Ground-up hotel and hospitality construction across Texas, from Hilton-branded select-service builds to larger properties in Houston, Dallas, and Austin.",https://www.maxxbuilders.com/industries/hotel-hospitality-construction-texas/
https://www.maxxbuilders.com/about/awards-and-recognition/,,Awards & Recognition | Maxx Builders,,,"See the awards and industry recognition earned by Maxx Builders, a Texas commercial general contractor serving Houston, Dallas, and Austin.",https://www.maxxbuilders.com/about/awards-and-recognition/
https://www.maxxbuilders.com/optimizing-warehouse-space-design-strategies/,,Optimizing Warehouse Space: Design Strategies for Efficiency & Flexibility | Maxx Builders,Warehouse Space Optimization: 7 Design Strategies,,"Optimize warehouse layout with seven strategies—vertical space, slotting, modular racking, aisles, and automation—from a Texas industrial contractor.",https://www.maxxbuilders.com/optimizing-warehouse-space-design-strategies/
https://www.maxxbuilders.com/projects/corporate-interiors/,,Corporate Interiors | Maxx Builders,,,"See Maxx Builders' corporate interior construction in Texas, featuring the J.D. Byrider build-out—commercial office and workspace fit-outs.",https://www.maxxbuilders.com/projects/corporate-interiors/
https://www.maxxbuilders.com/projects/hospitality-entertainment/,,Hospitality + Entertainment | Maxx Builders,,,"Explore Maxx Builders' completed hospitality and entertainment construction projects in Texas, including the Home2 Suites by Hilton hotel build.",https://www.maxxbuilders.com/projects/hospitality-entertainment/
https://www.maxxbuilders.com/expert-tips-insights/,,Expert Tips & Insights | Maxx Builders,,,"Construction tips and industry insights from Maxx Builders' commercial contractors—covering retail, hospitality, industrial, and healthcare in Texas.",https://www.maxxbuilders.com/expert-tips-insights/
https://www.maxxbuilders.com/what-is-constructability-review-the-benefits-for-your-next-project/,,What is Constructability Review & the Benefits for Your Next Project | Maxx Builders,Constructability Review: Benefits for Your Next Project,,Constructability review defines how easily a structure can be built. See its three core tenets and benefits beyond cost savings for Texas projects.,https://www.maxxbuilders.com/what-is-constructability-review-the-benefits-for-your-next-project/
https://www.maxxbuilders.com/portfolio/award-warehouse/,,Award Warehouse | Maxx Builders,,,"Explore the Award Warehouse project by Maxx Builders, a Texas commercial general contractor delivering industrial and warehouse construction.",https://www.maxxbuilders.com/portfolio/award-warehouse/
https://www.maxxbuilders.com/portfolio/king-spa/,,King Spa | Maxx Builders,,,Tour the King Spa project from Maxx Builders' portfolio—a commercial construction build delivered by a Texas general contractor serving Houston and Dallas.,https://www.maxxbuilders.com/portfolio/king-spa/
https://www.maxxbuilders.com/industry-trends/,,Industry Trends | Maxx Builders,,,"Commercial construction industry trends and insights from Maxx Builders, a general contractor serving Houston, Dallas, and Austin, Texas.",https://www.maxxbuilders.com/industry-trends/
https://www.maxxbuilders.com/portfolio/y-shops-morton/,,Y-Shops @ Morton | Maxx Builders,,,"Y-Shops @ Morton is a retail shopping center project built by Maxx Builders, a Texas commercial general contractor. See the project in our portfolio.",https://www.maxxbuilders.com/portfolio/y-shops-morton/
https://www.maxxbuilders.com/office-construction-how-to-meet-deadlines-without-sacrificing-quality/,,Office Construction: How to Meet Deadlines Without Sacrificing Quality,Office Construction: Meet Deadlines Without Losing Quality,,"Hit office construction deadlines without sacrificing quality—planning, project management, collaboration, and risk control strategies for Texas builds.",https://www.maxxbuilders.com/office-construction-how-to-meet-deadlines-without-sacrificing-quality/
https://www.maxxbuilders.com/industries/fitness-gym-construction-texas/,,Fitness & Gym Construction Texas | Maxx Builders,,,"Texas fitness and gym construction from Maxx Builders — Anytime Fitness buildouts to full health clubs across Houston, Dallas, and Austin.",https://www.maxxbuilders.com/industries/fitness-gym-construction-texas/
https://www.maxxbuilders.com/portfolio/sarai-properties/,,Sarai Properties | Maxx Builders,,,"Explore the Sarai Properties project in the Maxx Builders portfolio, showcasing our commercial construction and general contracting work across Texas.",https://www.maxxbuilders.com/portfolio/sarai-properties/
https://www.maxxbuilders.com/portfolio/sterline-banquet-hall/,,Sterline Banquet Hall | Maxx Builders,,,"Explore the Sterline Banquet Hall project, a Texas hospitality and entertainment venue built by Maxx Builders' commercial general contracting team.",https://www.maxxbuilders.com/portfolio/sterline-banquet-hall/
https://www.maxxbuilders.com/industries/healthcare-medical-construction-texas/,,Healthcare & Medical Construction Texas | Maxx Builders,,,"Maxx Builders delivers healthcare and medical construction across Texas, from dental offices to medical facilities in Houston, Dallas, Austin and beyond.",https://www.maxxbuilders.com/industries/healthcare-medical-construction-texas/
https://www.maxxbuilders.com/portfolio/anytime-fitness/,,Anytime Fitness | Maxx Builders,,,Explore Maxx Builders' Anytime Fitness project—commercial construction and tenant improvement delivering a Texas fitness center build. See the portfolio.,https://www.maxxbuilders.com/portfolio/anytime-fitness/
https://www.maxxbuilders.com/5-key-insights-trends-in-retail-from-icsc-recon-2019/,,5 Key Insights & Trends in Retail from ICSC RECon 2019 | Maxx Builders,5 Retail Trends from ICSC RECon: Texas Construction Guide,,"Retail trends from ICSC RECon plus a Texas retail and restaurant construction playbook—2026 market considerations, submarkets, and build-out phasing.",https://www.maxxbuilders.com/5-key-insights-trends-in-retail-from-icsc-recon-2019/
https://www.maxxbuilders.com/latest-news-updates/,,Latest News + Updates | Maxx Builders,,,"Read the latest news, updates, and project announcements from Maxx Builders, a Texas commercial general contractor serving Houston, Dallas, and Austin.",https://www.maxxbuilders.com/latest-news-updates/
https://www.maxxbuilders.com/portfolio/24-7-gas-station-sam-houston/,,24/7 Gas Station @ Sam Houston | Maxx Builders,,,"See the 24/7 Gas Station at Sam Houston, a commercial fuel station built by Maxx Builders, a Texas general contractor serving the Houston metro.",https://www.maxxbuilders.com/portfolio/24-7-gas-station-sam-houston/
https://www.maxxbuilders.com/portfolio/holiday-inn-express/,,Holiday inn Express | Maxx Builders,,,Explore Maxx Builders' Holiday Inn Express project—a Texas hospitality construction build showcasing our hotel general contracting expertise.,https://www.maxxbuilders.com/portfolio/holiday-inn-express/
https://www.maxxbuilders.com/portfolio/24-7-gas-station-airtex/,,24/7 Gas Station @ Airtex | Maxx Builders,,,Explore Maxx Builders' 24/7 Gas Station @ Airtex project — a Texas fuel station built and delivered by our commercial general contracting team.,https://www.maxxbuilders.com/portfolio/24-7-gas-station-airtex/
https://www.maxxbuilders.com/portfolio/agas-banquet-hall/,,Agas Banquet Hall | Maxx Builders,,,"Explore the Agas Banquet Hall project by Maxx Builders, a Texas commercial construction build for the hospitality and entertainment sector.",https://www.maxxbuilders.com/portfolio/agas-banquet-hall/
https://www.maxxbuilders.com/portfolio/calder-plaza/,,Calder Plaza | Maxx Builders,,,"See how Maxx Builders delivered the Calder Plaza commercial construction project in Texas. Explore the scope, build approach, and completed results.",https://www.maxxbuilders.com/portfolio/calder-plaza/
https://www.maxxbuilders.com/portfolio/pinnacle-retail/,,Pinnacle Retail | Maxx Builders,,,"Explore Maxx Builders' Pinnacle Retail project, a Texas commercial general contractor delivering retail and shopping center construction statewide.",https://www.maxxbuilders.com/portfolio/pinnacle-retail/
https://www.maxxbuilders.com/portfolio/y-shops-long-meadows/,,Y-Shops @ Long Meadows | Maxx Builders,,,See how Maxx Builders delivered the Y-Shops @ Long Meadows retail shopping center as commercial general contractor in Texas. Explore the project scope.,https://www.maxxbuilders.com/portfolio/y-shops-long-meadows/
https://www.maxxbuilders.com/top-5-factors-that-influence-the-cost-of-office-remodel-or-build-out-of-your-space/,,Top 5 Factors That Influence the Cost of Office Remodel or Build-Out of your Space | Maxx Builders,Office Build-Out & Remodel Cost: 5 Factors in Texas,,"Explore the five factors that drive office remodel and build-out costs: space condition, size, finishes, layout, and schedule, plus Texas TI tips.",https://www.maxxbuilders.com/top-5-factors-that-influence-the-cost-of-office-remodel-or-build-out-of-your-space/
https://www.maxxbuilders.com/how-to-maximize-roi-with-smarter-design-construction-on-the-warehouse-distribution-center/,,How to Maximize ROI with Smarter Design + Construction on the Warehouse Distribution Center | Maxx Builders,Maximize Warehouse ROI: Smarter Texas Design-Build,,"Maximize ROI on Texas warehouse and distribution center builds—where per-SF costs run $45–$150+, the key cost drivers, and budgeting mistakes to avoid.",https://www.maxxbuilders.com/how-to-maximize-roi-with-smarter-design-construction-on-the-warehouse-distribution-center/
https://www.maxxbuilders.com/office-build-out-cost-per-sf/,,Office Build-out Cost Per SF | Maxx Builders,,,"Texas office build-out costs per square foot: tenant improvement best practices, brand and lease coordination, schedule sequencing, and cost benchmarks.",https://www.maxxbuilders.com/office-build-out-cost-per-sf/
https://www.maxxbuilders.com/4-major-strategies-in-commercial-real-estate-investing-explained/,,4 Major Strategies in Commercial Real Estate Investing Explained | Maxx Builders,4 Commercial Real Estate Investing Strategies Explained,,"Compare the four commercial real estate investing strategies—core, core plus, value-add, and opportunistic—and how they shape Texas construction.",https://www.maxxbuilders.com/4-major-strategies-in-commercial-real-estate-investing-explained/
https://www.maxxbuilders.com/client-resources/faq/,,FAQ | Maxx Builders,,,"Common questions about Maxx Builders' Texas commercial construction services: general contracting, design-build, preconstruction, and tenant improvements.",https://www.maxxbuilders.com/client-resources/faq/
https://www.maxxbuilders.com/client-resources/project-planning-guide/,,Project Planning Guide | Maxx Builders,,,A client planning guide from Maxx Builders for owners preparing a commercial construction project in Texas. Know what to expect before you break ground.,https://www.maxxbuilders.com/client-resources/project-planning-guide/
https://www.maxxbuilders.com/services/general-contracting/,,General Contracting | Maxx Builders,,,"Commercial general contracting across Texas from Maxx Builders—serving Houston, Dallas, Austin, Fort Worth, and San Antonio. Request a project estimate.",https://www.maxxbuilders.com/services/general-contracting/
https://www.maxxbuilders.com/client-resources/industry-news-and-trends/,,Industry News + Trends | Maxx Builders,,,"Stay current with commercial construction news, market shifts, and industry trends from the Maxx Builders team serving Texas.",https://www.maxxbuilders.com/client-resources/industry-news-and-trends/
https://www.maxxbuilders.com/portfolio/pearl-apartment/,,Pearl Apartment | Maxx Builders,,,"Explore the Pearl Apartment project by Maxx Builders, a Texas commercial general contractor specializing in multi-family and mixed-use construction.",https://www.maxxbuilders.com/portfolio/pearl-apartment/
https://www.maxxbuilders.com/portfolio/grand-mission/,,Grand Mission | Maxx Builders,,,"Explore the Grand Mission commercial construction project by Maxx Builders, a Texas general contractor. See the project scope and delivery details.",https://www.maxxbuilders.com/portfolio/grand-mission/
https://www.maxxbuilders.com/portfolio/lus-barbershop/,,Lus Barbershop | Maxx Builders,,,Inside Maxx Builders' Lus Barbershop project — a retail barbershop buildout delivered by our Texas commercial construction team.,https://www.maxxbuilders.com/portfolio/lus-barbershop/
https://www.maxxbuilders.com/portfolio/heartland-dental/,,Heartland Dental | Maxx Builders,,,"Explore the Heartland Dental project by Maxx Builders, showcasing our commercial dental office construction as a Texas general contractor.",https://www.maxxbuilders.com/portfolio/heartland-dental/
https://www.maxxbuilders.com/portfolio/home2suites-by-hilton/,,Home2suites by Hilton | Maxx Builders,,,Explore Maxx Builders' Home2 Suites by Hilton project — a hospitality construction build delivered by our Texas commercial general contracting team.,https://www.maxxbuilders.com/portfolio/home2suites-by-hilton/
https://www.maxxbuilders.com/portfolio/j-d-byriders/,,J.D.BYRIDERS | Maxx Builders,,,Explore the J.D. Byrider project in Maxx Builders' portfolio of commercial construction work delivered by our Texas general contracting team.,https://www.maxxbuilders.com/portfolio/j-d-byriders/
https://www.maxxbuilders.com/portfolio/middle-spoon/,,Middle Spoon | Maxx Builders,,,"See the Middle Spoon project delivered by Maxx Builders, a Texas commercial general contractor serving Houston, Dallas, Austin, and beyond.",https://www.maxxbuilders.com/portfolio/middle-spoon/
https://www.maxxbuilders.com/portfolio/vivaldi-music-academy/,,Vivaldi Music Academy | Maxx Builders,,,"See the Vivaldi Music Academy project delivered by Maxx Builders, a Texas commercial general contractor, featured in our completed project portfolio.",https://www.maxxbuilders.com/portfolio/vivaldi-music-academy/
https://www.maxxbuilders.com/portfolio/glazed-doughnut-cafe/,,Glazed Doughnut Cafe | Maxx Builders,,,"Explore the Glazed Doughnut Cafe project by Maxx Builders, a Texas commercial contractor delivering restaurant and cafe construction.",https://www.maxxbuilders.com/portfolio/glazed-doughnut-cafe/
https://www.maxxbuilders.com/portfolio/y-shops-parkwest/,,Y-SHOPS @ PARKWEST | Maxx Builders,,,"Explore Y-Shops @ Parkwest, a retail shopping center project by Maxx Builders, a Texas commercial general contractor serving Houston, Dallas and Austin.",https://www.maxxbuilders.com/portfolio/y-shops-parkwest/
https://www.maxxbuilders.com/portfolio/throwback-bar-grill/,,Throwback Bar & Grill | Maxx Builders,,,Throwback Bar & Grill by Maxx Builders: a Texas restaurant and bar construction project delivered by our commercial general contracting team.,https://www.maxxbuilders.com/portfolio/throwback-bar-grill/
https://www.maxxbuilders.com/portfolio/kool-korner-mart/,,Kool Korner Mart | Maxx Builders,,,"Explore the Kool Korner Mart project by Maxx Builders, a commercial general contractor serving Houston, Dallas, Austin and San Antonio, Texas.",https://www.maxxbuilders.com/portfolio/kool-korner-mart/
https://www.maxxbuilders.com/portfolio/fresh-fast/,,Fresh & Fast | Maxx Builders,,,"Explore the Fresh & Fast project in the Maxx Builders portfolio — commercial construction by a Texas general contractor serving Houston, Dallas & Austin.",https://www.maxxbuilders.com/portfolio/fresh-fast/
https://www.maxxbuilders.com/portfolio/24-seven-cullen/,,24 Seven @ Cullen | Maxx Builders,,,"Explore 24 Seven @ Cullen, a commercial construction project delivered by Maxx Builders, a Texas general contractor serving Houston and beyond.",https://www.maxxbuilders.com/portfolio/24-seven-cullen/
https://www.maxxbuilders.com/portfolio/comfort-suites/,,Comfort Suites | Maxx Builders,,,"See how Maxx Builders built the Comfort Suites hotel, a Texas hospitality construction project showcasing our commercial general contracting work.",https://www.maxxbuilders.com/portfolio/comfort-suites/
https://www.maxxbuilders.com/portfolio/express-mart/,,Express Mart | Maxx Builders,,,"Explore the Express Mart project in Maxx Builders' portfolio, delivered by a Texas commercial general contractor serving Houston, Dallas, and Austin.",https://www.maxxbuilders.com/portfolio/express-mart/
https://www.maxxbuilders.com/portfolio/shoe-palace/,,Shoe Palace | Maxx Builders,,,Explore the Shoe Palace retail project by Maxx Builders — a Texas commercial construction and tenant buildout delivered by our general contracting team.,https://www.maxxbuilders.com/portfolio/shoe-palace/
https://www.maxxbuilders.com/portfolio/minnonite-retail/,,Minnonite Retail | Maxx Builders,,,"See the Minnonite Retail project by Maxx Builders, a Texas commercial general contractor delivering retail construction across Houston, Dallas, and Austin.",https://www.maxxbuilders.com/portfolio/minnonite-retail/
https://www.maxxbuilders.com/portfolio/y-shops-sam-houston/,,Y-Shops @ Sam Houston | Maxx Builders,,,"Y-Shops @ Sam Houston: a retail shopping center delivered by Maxx Builders, a Texas commercial general contractor. See the project scope and results.",https://www.maxxbuilders.com/portfolio/y-shops-sam-houston/
https://www.maxxbuilders.com/portfolio/riverpointe-retail/,,Riverpointe Retail | Maxx Builders,,,"Riverpointe Retail: a retail shopping center project delivered by Maxx Builders, a commercial general contractor building across Texas.",https://www.maxxbuilders.com/portfolio/riverpointe-retail/
